,CUSTOMER_NAME,REVIEW_TITLE,REVIEW_COMMENTS,RATINGS,SOURCE,OVERALL_SENTIMENT
116,MrsSKaur,Decent for casual listening,"The JBL Live Pro 2 TWS headphones are decent for casual listening but have some flaws that prevent them from being great. The sound quality is pretty good, with emphasized bass and good clarity in the mids and highs. The active noise cancellation works okay in reducing low-end noise but isn't as effective against voices and higher frequencies. The design is comfortable for short periods but can cause ear fatigue during longer listening sessions. The touch controls are responsive but take some getting used to. Battery life is about 5 hours with ANC on, which is average but requires frequent recharging. Overall, the JBL Live Pro 2 headphones work well for commute and gym use but aren't versatile enough for all-day wear. At their price point, there are other options that offer better noise cancellation, comfort and battery life. They're fine for casual use but serious audiophiles may want to consider other headphones in this price range.",3,jbl,Negative
117,Meghan,Amazing ear buds with minor draw backs!!,"Overall I am loving these wireless ear buds! When I first received them I liked the compact design and case felt well built. The compact case is definitely a sleek design. But because the case is more flat instead of tall, I found opening the case was a bit tricky and a 2 handed operation. The sound quality is amazing with good bass and an overall clear sound. I did find that after extended use, the plastic portion (not the rubber changeable part) of the ear buds did seem a bit too big in my ear and felt slightly uncomfortable but they stayed in my ear better than other ear bud designs. The noise canceling from these are amazing. Standing next to my washing matching while it was running sounded completely silent with ear buds in and no music playing while connected to my phone.",5,jbl,Positive
118,Veeee,Surprisingly Great,"I bought these after reading the What HiFi review. In these ear buds, JBL have created seemingly high quality buds that sound amazing and made from quality materials all at a very reasonable price. The pebble like case is small and slick in design, and looks better than other well known brands. In the ear, these look smart and not bulky which suits me with my small ears! The sound is as good as What HiFi says, I'm enjoying bass and treble without any harshness whatsoever.",5,jbl,Positive
119,supersonic88,"Super comfy, great battery life, sound is great","These are super comfortable to wear for hours, it has a good seal and it is very lightweight. There is no ear fatigue after using this. 

The batteries last for hours on end and I am also a fan of the 15 minute quick charge. 

The size of the case is nice and small. I think I would have preferred the case to be wider to get it flatter so it fits in the pocket better but that is me nick picking.

The sound quality overall is great, the EQ is a nice addition but the noise cancelling isn't worth using; it naturally blocks out most background noise already and there is very little difference between it on or off.",4,jbl,Positive
120,Kentourcf,Amazing,"I bought these earbuds a few weeks ago and quite honestly I am surprised by the quality! firstly what I really liked was the option to block noise, itâs incredible how perfectly it works. then, the quality of the microphone when I'm on a phone call is great! and you can know the battery of the charging case thanks to 3 small lights. the only negative point is that personally the different sizes of ear tips  do not suit me. anyway I validate these earbuds !",5,jbl,Positive
121,Lm12,Complete waste of money.,"When I first bought this product, I was instantly disappointed.

Sound quality is crisp, but these run very quietly. When using in the gym, theyâre almost useless as they simply donât go loud enough. 

Iâve used MIFO and APPLE for years prior and both were fantastic. JBL is renowned for being a quality brand but I must say, this just isnât the case at all.

Not only were they MUCH quieter than any other headphones Iâve owned, they also CONSTANTLY dropped out, disconnected themselves, constantly made âgestureâ noise whilst playing even when all gestures are turned off which was very frustrating.

Things then get worse as the headphones have now blown - now they get used 5 times per week for 1-2 hours at most using only the EQ settings that come integrated with the headphonesâ¦ Iâve NEVER had a pair of headphones blow. These are approximately only a year old now.

When expressing the fault to customer service, I was offered a replacement and when I pointed out the customers are reporting the same issues, they didnât care. They clearly have a faulty product and even the newer model has the same reviewsâ¦ so they have no interest in resolving the fault.

Donât waste your money with JBL.

If you read the other reviews, it seems Iâm far from the only person experiencing these issues.",1,jbl,Negative
122,RD2023,Overall great!,"Firstly I really liked the size of the charging case which is nice and compact making it easy to carry around compared to other buds I have used in the past.  I also really like the finish of the buds which look classy particularly with the metal finish. The battery life is extremely good and I have not had to worry about recharging as frequently as my previous headphones despite using them frequently. I found the app very easy to use and navigate between options of adjusting sound quality and accessing the features such as noise cancelling.  The adaptive noise-cancelling function is overall good and adjusts to your surroundings however I have found rivals slightly better in blocking out those unwanted noises. However, the sound quality in my opinion is great.  Very clear and brilliant baseline.  Overall, I feel this is great value for money.",5,jbl,Positive
123,Su3d3,Disappointing :-(,"I bought JBL over-the-ear headphones and they worked great, so when JBL had their great 50% sale, I bought these earbuds for working out. I am happy with the quality of sound and the controls, however, the earbuds cut out every few minutes. It is quite frustrating. I talked with JBL customer service and to their credit, sent me new ones under the guarantee. Right out of the box, the new ones are doing the same thing and I feel the longer I wear them, the more frequent the cut outs occur.  I have older earbuds I have gone back to that don't have problems, so it isn't my phone. If something like this doesn't bother you, buy them, but it does me so I have stop using them. I cannot, in good faith, sell them to someone else knowing they do not work right, so now they just sit there. :-(",1,jbl,Negative
124,Top_Gear_Fanboy,Great quality and comfort,I really enjoyed this product. They are actually extremely comfortable in your ears and Ive worn them for a great deal of time and I don't really get any fatigue. The app is also pretty cool and allows you to change in between the different modes (basically whether it passes in outside sound or just uses noise canceling). Overall I really enjoyed them. I also liked how small their case was as it was very convenient.,5,jbl,Positive
125,BlondeAzn,AMAZING!,"I canât believe how amazing these earbuds are! This is the third set of JBL earbuds that Iâve been lucky enough to try and this by far is the best ones yet. The charging case is a little square. Sleek and not bulky. I absolutely love the interchangeable noise canceling feature. The quality of the sound is so clean and crisp. I wear these while I workout and Iâve had 0 issue with them falling out. They are very comfortable and fit my ears perfectly. They take about 15 mins to change and once charged, I can use them for a few days depending on how many hours I use em. Thereâs a little light indicator on the case to let me know when I need to charge them. A nice feature is they can be charged wirelessly. The touch feature is perfect for working out so I donât have to reach for my phone, I can just tap the earbud to pause my music. I got the blue pair but I know them come in different colors.",5,jbl,Positive
126,UKears,Great product,"Exceptional product, sound quality, design, colour amazing ( I went for the silver/grey ones) ease of use is just really good. Iâve used apple wireless headphones for a number of years but decided to go with the live pro 2s, they look way better than AirPod pros too.

I paid Â£130 but they are Â£99 now maybe JBL will honour the discount for me too as I only ordered it last week. :)",5,jbl,Positive
127,Adrian23,I love them,"High-quality sound and excellent call quality on both ends, a comfortable yet secure fit, and a feature-rich Android app. What more could I ask for? After owning (and getting disappointed by) Samsung, Pixel, and Anker buds, I'm pleasantly surprised and highly satisfied with this pair. I received them as a gift. I've never had anything from JBL before, and I never would have thought of buying anything, but now I'm looking forward to trying out more of their stuff, and I would highly recommend these earbuds.",5,jbl,Positive
128,Paul,"Great sound, good fit and useful features",I've had these for a month now to replace a good set of Denon wired earbuds and the sound is every bit as clear and punchy. The rubber earpieces mean they fit far better than the cheaper JBL buds with the hard plastic casings. Batter life seems good and with wireless charging it's easy to keep the case charged up. It can also be charged by usb-c cable from my phone if needed. The JBL app is easy to use and allows you to modify the touch controls and equaliser to a good degree. Overall these are a big step up from cheaper Â£20-60 earbuds without spending Â£200+ on more premium makes,5,jbl,Positive
129,durandal,Best JBL TWS headphones,"This is the best TWS headset that JBL makes. Sounds great, very compact wven with case, and good noise canceling.  Only thing that could be better is a little better microphone cancelling when on a call as some people on other end have complained.",5,jbl,Positive
130,pastorod23,Too many issues,"I was so excited to get these buds as I've been a fan of JBL for years, having a JBL soundbar. The sound produced is incredible. So I was sold on these buds, knowing I wouoldn't have to worry about its sound. The things most important to me was the alldged 10 play time that was advertised, and the water resistance. I bought these directly from JBL. Again, the sound qulaity was totally awesome. I can hear my music clearly in a loud environment as well. So I bought these to use primarily at work. I average 9 - 10 hours a day. Well in using these buds, I was only getting less than 8 hours on a full charge with noise canceling turned off. They also displayed an intermittent connection were the sound would go in and out. I thought it might be my phone signal but it wasn't. Music and video kept playing during periods of unstable connection. It hapened every single time after I connect my bluetooth to my new S22 Ultra 5G. I haven't had any other these problems with any other bluetooth device. Then the 10 hour play would become less and less. I'd only get 6 - 7 hours of play. I then bought a second JBL Live Pro 2 from an authorized vendor because I felt the ones I had were possibly defective. Since I only had the first pair for two weeks I sent them back for a refund. I got my second Live Pro 2, but the connectivity was exactly the same as the first pair. However, I'm only average 4 - 5 hours of play. Again this is without noise cancelling on. Before returning the first pair, I had called tech support and was told the shortened battery life was due to the volume level and other reasons not listed anywhere on the box. While these have incredible sound, it has too many major issues. Even my Galaxy buds 2 gives me more play time.",3,jbl,Negative
131,X27D,Good headphones but...,"Headphones are good, audio fidelity is above average, not amazing. However, they are let down by a terrible accompanying app, which for some bizarre reason must be downloaded to use them with an android device. They also occasionally dropout for no reason on to resume a second latter, hopefully this will be resolved with a firmware update.",3,jbl,Negative
132,Meluma,such a power in a small box,"I've been using these fro some time now, and they are brilliant! much more comfier than my previous ones and doesn't fall out of the ear. Noise cancellation is amazing and once on you can't hear e.g. cars going past outside( I live near busy road), or rain.  Voice calls are so much higher quality than before, finally the recipient of the call can hear me without any sound disruptions. in general sound quality is very good, with the correct settings that you can choose in the app you can feel like you are in the concert if listening to music, or in the filming plot if watching a movie or any other clip. personally I liked all the design from the charge box which was small and compact to the earbuds and colour was not the boring black and a bit different. Also very handful function for me, who always loses small things was 'find my buds', hopefully won't ever need to use it, but it's great it is there. the only downside why I am giving it 4 stars was : when the app needed to be updated and I was listening to music it started to pause frequently until I updated the app, which was a bit annoying, but anyway all good.",4,jbl,Positive
133,Florian R,Elevating Your Cycling Experience,"I'm an avid cyclist, and I recently got my hands on the JBL Tune Beam true wireless earbuds, and I'm absolutely thrilled with my purchase.

These earbuds are a game-changer for my rides. With up to 48 hours of outstanding JBL Pure Bass Sound, I can tackle any cycling route while enjoying my favorite tunes. Their ergonomic design ensures all-day comfort, and the fact that they're water and dust resistant is a huge plus, especially during unpredictable weather.

What I love most is the touch-sensitive controls, making it super easy to manage calls without being bothered by ambient noises. The Active Noise Cancelling and Smart Ambient technology are fantastic features, allowing me to decide whether I want to disconnect from the world or stay aware of my surroundings for safety.

The secure fit and noise isolation due to the stick-closed design enhance the overall audio experience. Plus, the JBL Headphones App lets me customize my listening experience to perfection.

In summary, the  earbuds have truly elevated my cycling adventures. They keep me connected and entertained while ensuring my safety and comfort. Highly recommended for fellow cyclists!",5,jbl,Positive
134,Jbl_customer,Good headphones,"This product is great! I decided to splurge and not get the cheapest wireless headphones I could find. These are well worth the investment. No buttons to break or that require you to mash them into your ear to pause. The magnetic clasp feels sturdy and secure. They last almost a week on a full charge (using them for about an hour or two a day).

The only small thing is that occasionally the audio cuts out for a split second. I don't know if it's my phone or the headphones, but it happens rarely enough that I'm assuming the next software update will take care of it.",4,jbl,Positive
135,barrayar1,Great Sounds,The JBL Live Pro 2 In Ears have a great sound. It can be scaled even better by downloading the JBL Headphone app. What is noticeable is that the bass portion is always too high - even in the vocal setting. The small charging case is nice and fits in any trouser pocket. The charging case is connected to a high-speed charging cable within 2 hours. The InEars are fully charged within a good 3 1/2 hours. The charging case still has 60% charge. The InEars adapt perfectly to the ear cups and the ANC is awesome - the JBL InEars are really only recommended.,4,jbl,Positive
136,Snfv,Not nice,Was raining and they stop to work nor even a week since I bought them,1,jbl,Negative
137,Hextreme,Wow!,"I have many sets of earbuds including the Sony xm4's and these JBL Live Pro 2 are the best I have owned so far. The audio quality is fantastic and using the app allows me to change settings to get the quality perfect for me. Bass is really good. My big surprise is the quality of the mic for calls. As long as you speak clearly and slowly, the person on the other end will hear you even with background noise. The noise cancelling, whilst not the best I have had, is perfectly adequate for me. Overall I recommend these as they are good all rounders.",5,jbl,Positive
138,boomslang,Good sound. Abominable connection stability,"These sound great - if you like your audio punctuated with dropouts and disconnects. I really like the sound of these. The ANC is excellent. The connectivity is atrocious, it's shamefully bad and I cannot overstate how bad it is with _all_ of my devices. I wish I'd returned them, but kept being promised issues would be fixed after software updates which only marginally helped if at all. It's not even that I've got a bad set, my wife's are almost as bad. It's a real shame because JBL usually produce high quality gear. Would not recommend.",1,jbl,Negative
139,Felix Cherry,Disconnect seriously when using outdoor,"I bought this earphone this August on the 19th, sound quality is nice noise cancellation does it work indoor. However, when using outdoor it continues to disconnect and disconnect seriously, call me this situation be resolved is a critical. it will be kind enough of you to let me have a solution to avoid outdoor disconnection.",1,jbl,Positive
140,Cheks,Very disappointed,"Iâve had these for almost 6 months. Theyâve never really been jaw dropping like the way a lot of people say. People cannot hear me properly when Iâm on the phone, thereâs no noise cancellation on them and worst of all, Iâd have my music on blast in my ears but the outside world is way louder! It sounds like the volume is on low constantly. The charge time definitely does not last as long as it says it does for me. I donât know if I got a bad batch but itâs sub par quality. I should have just stuck with AirPods.",2,jbl,Negative
141,Gdon,These are unbelievably great,"Fantastic little things.
Connect rally easy to different units in my home. Are loud clear and excellent sound
I WEAR HEARING AIDS ( over ear )  yet these still fit into my ears are snug, comfortable and donât move when Iâm on the treadmill .
Iâve tried some before and they were not even as half as loud as these and they were dearer, and the wer really uncomfortable
I am just so pleased to have them and would never thought to buy them accept Harvey Norman had a 30 day money back offer, so I thought what the heck I will give them a go . 
The app is great to boost up to what you want.
Iâve seen where people say they would prefer the headphones to have volume on the headphones and not just the app, but if you read the instructions you can set up the left one for volume as easy as pie.",5,jbl,Positive
142,Jaye99,Second bluetooth device keep disconnect.,I been using this earbud & start to notice that second device that pairing alway disconnect after 30mins of use. but there is no issue on primary device. Any advice on how to fix it? In general ear bud sound very good.,3,jbl,Positive
143,joji35,cuts out all the time,"I've had these for a little for over a month and the sound is amazing, but the Bluetooth connectivity is horrible. I have had 2 other pairs of wireless headphones in the past and granted they cut out from time to time, but THESE cut out ALL THE TIME> it's super annoying. also have noticed it's worse depending on what type of clothing I'm wearing and the pocket material. most times I have to walk around with my phone in my hand. and it's not the phone because I've tested on another device.",2,jbl,Negative
144,momof2,Sleek and mighty in a small package,"Sleek and attractive right out of the box.  I have the blue - which is a cool metallic color.  Once inserted, could immediately sense the noise cancellation properties.  Comfortable and lightweight in ear.  The headphones linked easily to my iPhone - all to had to do was find it listed under Bluetooth and clicked on the link to connect.   Controls were easy enough to figure out.  Sounds quality was great - Iâm not an audiophile but my music sounded great - a good mix of treble and bass.",5,jbl,Positive
145,good but bad,"Good earbuds, problem","I honestly really liked them, the noise cancelling was good so was the equalizer, but after only a month a half of using them the left ear bud simply stopped working properly, The left earbud would almost never charged. The right earbud and case worked perfectly.I tried cleaning it resetting it everything. I never got it wet dropped the case but they just stopped working after a month and a half. There was almost no advice on this. They were good, but no one likes to use one earbud.",2,jbl,Negative
146,hirtspeedy,Over priced,"I bought this earphones about two weeks ago by $87, I lost one and now you are buying the same one for $63 dollar extra, really? Come on JBL!!!!",1,jbl,Negative
147,jhp04,JBL Live Pro 2 TWS - just one gripe,"Nice packaging on delivery, feels like a premium product.  Very easy to use and pair with my iPhone- doesnt seem to drop connection like some other headphones.  Comfortable to wear. The microphone is good and i tend to be heard loud and clearly on calls. Sound quality is also good - maybe a little too bass-y.  Battery tends to last too. 
my only gripe is the lid of the charger/holder which feels very flimsy and easy to break.  Other than that, a good set of headphones.",4,jbl,Positive
148,bobby0712,overall..,"the sound quality is spectacular with a bunch of different options! volume is also wonderful, though very loud. i think i might of screwed up my hearing tbh but thatâs not the earbuds fault. 
the battery life is also spectacular! i would charge them every night since i would typically use them all day and they would last! if battery was close to dying on the buds, just put âem back in the case for a few minutes and it would last another couple hours. 

my only issue with the buds is comfortability. my ears are so sore after using these earbuds!! iâve tried all of the different size rubber ear thingies and it didnât change anything. though itâs probably just my ears. that really bummed me out because i got them as a christmas gift. 

overall iâd give the earbuds a 3/5 because comfortability is extremely important to me!",4,jbl,Positive
149,Draugs,Great quality earbuds,"The JBL Live Pro 2 earbuds have truly impressed me. The active noise cancellation feature is a game-changer, allowing me to enjoy my music or podcasts without external distractions. Their comfortable fit makes them ideal for long listening sessions, and I never worry about them falling out during workouts.

The touch controls are intuitive and responsive, giving me easy access to playback and calls. Plus, the long battery life means they last throughout the day.

I appreciate their water-resistant design; it gives me peace of mind when using them during workouts or in unpredictable weather.

In summary, the JBL Live Pro 2 earbuds offer top-notch audio quality and advanced features. They've become an essential part of my daily life, providing an exceptional listening experience. Highly recommended for those seeking high-quality wireless earbuds.",5,jbl,Positive
150,RandomHero,Great sound for great price! Very intuitive.,"I bought these a month ago to replace my old JBL Tune buds that stoped charging. I'm super impressed with the design of the buds and the case. The active noice cancelling has worked great.  Another bonus is that the ear buds fit perfect for me and are really comfortable!
JBL has shown me that they are a great brand with great products! I would reccomend the Live Pro 2 buds to anyone that wants great sound at a great price.",5,jbl,Positive
151,Kerry O,A great all rounder!,"These ear buds have really good sound, good base and amazing noise cancellation. They are comfortable to wear and also look stylish. The battery hold is also amazing, lasting for days without needing to be charged, unlike some cheaper brands that only last a day if that! Iâd certainly recommend these ear buds as they are great not just for every day listening, but also working out or just out walking! A good all rounder.",4,jbl,Positive
152,Sabby789,Great,"I bought these headphones a month ago and ao far so good. They fit well and the sound quality is excellent. In terms of the battery life, it lasts around 5 hours out of the case, and then you have to put it back in the case, and then it recharges in the case. The case battery lasts for a long time. So all in all, I'm happy, but there are times I would have liked to use them continuously for more than 5 hours but cant.",4,jbl,Positive
153,tootoochan,its waterproof but cannot swim with them,"disappointed.  i am returning them. they are IPX8 waterproof but the sensors are too sensitive such that the ear pods connect and disconnect and connect and disconnect multiple times when the pods sense the pressure of the water / waves in the swimming pool.  Maybe i should not have expected waterproof ear pods to be suitable for swimming.  I was not diving. 

if you dont buy them for swimming, then they work fine.",3,jbl,Negative
