,CUSTOMER_NAME,REVIEW_TITLE,REVIEW_COMMENTS,RATINGS,SOURCE,OVERALL_SENTIMENT
85,ThatGuyYouKnow,Blown away by the improvements,"So I have a pair of the JBL Live Pro + headphones. They have been my everyday earbuds since I got them and I was super happy with them minus a couple exceptions. When I saw the Live Pro 2, I knew I had to get a pair and try them out. I wanted to see what was changed. I loved the sound of the Pro + but the Pro 2  sound even better. Now switching between the two, I can hear much better mids and highs than the Pro+. Even the bass is better on the Pro2, which I honestly didn't expect since the Pro+ had very good bass. I was also pleasantly surprised how much better they fit in my ears. The Pro+ were fine and I didn't have any fit issues at all but the Pro2 seem to just stick in my ears. When I shake my head they don't move at all. 
Another improvement that I noticed and really love is when using a gesture to switch between Active Noise Canceling, Ambient Aware, and TalkThru. The Pro+ would just beep and you would have to know which one you switched to. While this isn't a huge issue it made it sometimes difficult to tell. Now with the Pro2 you get voice feedback after switching between the different settings. The voice prompts can all be changed in the app to a handful of different languages or just off if you don't want it.  The gestures also were slightly updated, where now I can have my favorite assistant as a hold and still be able to skip, play/pause songs. This wasn't possible with the Pro+ as using an assistant used up all the gestures on the ear bud for the assistant. 
The JBL app also got a nice visual upgrade for these earbuds and some new features. There is now a VoiceAware slider so you can adjust the amount of your voice you hear on phone calls. There is also more settings to customize the ANC which is nice. 
The only thing I was hesitant on was the color. I usually get black but this time I got the blue. I'm happy I did, they look really sharp.
Overall, I'm really happy with these. They fit great, have awesome sound and have an even longer battery life. I can finally use them for a full day of work. I tend to listen to music or I'm always in some meeting or call for work. So I tend to have these in for close to 8 hours on a work day. It's nice not having to charge them during my lunch break in order for them to last the rest of the day. 
I can't recommend these enough, Great Product.",5,jbl,Positive
86,RipSpeed,Great pair of earbuds,"Absolutely in love with these earbuds! First of all they keep the charge really well which is very important for me,and charges quickly in the charging box. Sound quality is great,very good noise canceling. Came packed appealing to the eye. I can use them both or take just one for use,really convenient. Bluetooth pairing is top noch every time,pairs effortlessly,good Bluetooth range. Overall really happy with these gems",5,jbl,Positive
87,Elimel,Great All Around and Versatile,"These headphones are great! I have had multiple pairs of airbud-style headphones and these are by far the best pair! First of all, these are truly noise canceling. I am able to have a normal conversation without cranking the volume all the way up. They are also great for just kicking back and relaxing. The quality is amazing. They pair up the first time on my iPhone, The only issue I am having is they tend to fall out. I have tried multiple sizes of the included ear tips but they still tend to fall out after a little while. The bottom line is great a pair of headphones for avid listeners to serious business-minded professionals who make tons of calls daily.",4,jbl,Positive
88,prjio307,"Great Buds, Lots of Features, Subpar Mic","These headphones are wonderful if you are someone looking for high quality sound for music and movies/videos. For content consumption, these are some of the best sounding earbuds in this price point, and they honestly punch above their price point in terms of sound quality. 

However, if you are someone looking for great call quality for business calls, these are not it. Thatâs not to say that the mic is terrible, because itâs not. Itâs just not up to par when it comes to blocking our background noise. 

Sound quality: excellent, 5/5 in my opinion here. Highly customizable with EQ and app features. You can really fine tune the EQ across a wide range of frequencies. 

Comfort: again, excellent, 5/5. These are the most comfortable earbuds that Iâve worn in a long time. I forget they are in!

Noise cancellation: very good, 4/5. Excellent noise cancellation for this price point, but itâs not the best of the best. The noise cancellation is also customizable via the app and tunes itself to your surroundings and your ear shape. Cool stuff! I found that this did make a difference once I did this in the app. 

Ambient mode: excellent, 5/5. Conversations sound natural, like youâre not wearing anything. This is also customizable in the app as far as how much ambient sound you want to let in. Good stuff. 

Style: subjective. The buds speak for themselves but I find them to be very stylish! The color options are awesome and the blue color is stunning. 

Charging case & Battery life: this little case is awesome. 5/5 It packs 30 total hours of charge and charges FAST. Both the earbuds and the case charge very fast and last a LONG time. Much longer than other earbuds I have used. I can get through a whole workday just fine, with room to breathe. 5/5 for battery life. 

Features: oh boy - 5/5 for sure. Extensive EQ options, a video mode for lip syncing (not an issue for me, even in audio mode, but itâs nice to have!), talk through, customizable ambient mode, noise cancellation tuning, the list just goes on. These are very feature rich and customizable.

Connectivity: excellent 5/5. These paired up quickly and reconnect INSTANTLY when taking them out of the case. You can also use either earbuds independently of the other. 

The app: 5/5, very easy to use! Straightforward and easy to jump in and start tweaking to your liking. 

Call quality: hereâs where we run into some not so great. 2/5 here in my opinion. To be fair, folks I tested calls with told me they could hear me loudly, however I sounded a bit muffled and they could hear EVERYTHING in the background. They said it sounded like I was on speakerphone and they could hear all of my surroundings. In a quiet environment, it was fine, but in even a lightly noisy environment, these did not perform well. These are fine for calls when you are in a pinch, but I wouldnât buy them for this purpose. 

Overall, these are an awesome set of earbuds. Iâm very happy to see how far we have come in terms of truly wireless earbuds. The future is bright and I would recommend these buds to anyone looking for excellent sound quality, great noise cancellation, comfort, style, and features!",4,jbl,Positive
89,,The active noise cancellation is very efficient!,"I used to be sceptical about wireless earphones but these JBL earbuds changed my mind. The sound quality and bass depth is amazing. They are very comfortable and you do not really feel them even after a few hours of continuous use. At the same time they hold themselves in place securely. Even when exercising or running there is no need to re-insert or re-adjust them. The active noise cancellation is very efficient and its additional settings make it even more useful. The JBL app gives access to all the settings yet it is simple, logic and easy to use. The case looks good but the lid is a little wobbly both when opened and closed. Overall, I highly and sincerely recommend it :)",5,jbl,Positive
90,EricGCWI,My New Favorite buds,"I love these ear buds. I wish I could go back and give a slightly lesser review to some other buds I've had lol. The sound on these is great, deep bass sound and a rich atmosphere altogether. I love the low profile of these to your head. I drive a scooter and have problems with either volume, or wind noise from resistance on previous ear buds, but not with these! The sound cancelling is phenomenal. Just try being next to something loud, then turn it on and off, you'll notice a significant difference. The functionality is the same as other JBL products, easy tapping on either side for the functions you require. They paired immediately without a hitch and continue to pair every time I turn them on, zero hassles. The battery hasn't died on me yet from the initial charge, I've used them for probably close to an hour so far on rides and runs. They stay in really well and I don't get anxious about them falling out during activities.",5,jbl,Positive
91,B_parky,Find my bud. Doesnât work,I bought this product ilast November.  The sound is very good as expected. My other reason for buying is the fantastic battery life. Unfortunately I lost one of my buds in long grass but I was confident it wouldnât be a problem because of the âfind my bud feature. I contacted support as I couldnât get it to work and their reply was I had to put the lost bud in the case for the feature to work. Wow. Thatâs some kind of a crazy feature. I then asked if I could buy a replacement ear bud as the find my bud feature doesnât work and I would prefer not to throw out what I have left. The response from support. No you have to purchase a new set.,2,jbl,Positive
92,4NDR34S_TR0Y,Amazing sound for a great value,"The JBL Live Pro 2 true wireless earbuds are a bass-lover's dream, offering an impressive audio experience alongside several noteworthy features.

Adaptive Noise Cancellation: With adaptive noise cancellation, these earbuds allow you to escape into your music with minimal disruptions. Whether you're in a noisy office or a bustling cafe, the ANC feature ensures that you enjoy your tunes without external interference.

Extended Battery Life: The 40 hours of total battery is outstanding. You can use these earbuds throughout the day without worrying about running out of power. The ability to provide 10 hours of continuous playback on a single charge is particularly remarkable.

Bass-Heavy Sound: For those who appreciate bass-heavy music, the JBL Live Pro 2 delivers a rich and powerful bass experience. These earbuds are tailored for deep, thumping bass, making them ideal for genres like hip-hop and electronic music.

These earbuds are a fantastic choice for audiophiles who enjoy bass-heavy genres, and the combination of adaptive noise cancellation and an extended battery life ensures that you can immerse yourself in your music for hours on end. Whether you're a commuter or just a music enthusiast, the JBL Live Pro 2 earbuds are designed to enhance your listening experience.",5,jbl,Positive
93,brandon687,Great vocals and sound clarity,Overall I would recommend these headphones to anyone that goes to the gym or is busy and on the go they are easy to use and the connectivity is some of the best I have seen and used. The sound quality is crystal clear and itâs easy to hear and understand things or the vocals coming from the artist. The only reason I did not rate this as 5 stars is because the bass is lacking and I feel like the drivers could be bigger.,4,jbl,Positive
94,Glamourna,Good quality earbuds,"I bought the JBL earbuds about a month ago and let me tell you that I've been super content with them. The quality is supreme,very comfortable to wear them, i love the noise cancelling feature, the sound is superb, very clear and everything is on point. I have been very impressed about the battery life as well, lasts so much longer than the other leading brands.",5,jbl,Positive
95,JaeRaid,Was good till it wasn't...,"Honestly I do not recommend this 

I loved this earbuds when I first bought them. Perfect sound. Perfect noise cancellation feature. Basically they were worthy of their steep price... Till they weren't.

After 6 months they simply stopped working properly. No warning, they never fell or were damaged. The case can not hold charge and they continue playing even when in the case. This means they are always on hence draining battery of the earbuds and the case. Because of all this drama, I have to connect them to my phone while the case is on charge.... 

Basically I'm too frustrated, having to buy another pair from another brand.",1,jbl,Negative
96,Kathy2812,"Great sound, easy handling!","I use the headphones for over a week now as a testing product and I love them. They are my regularly companions at my dog walks. I love to hear audio books during my walks. The sound is brilliant. I live it that you can switch out ambient sounds, so that you just hear the audio book or the current song. Great quality. 
Iâm very astonished about the good quality at phone calls. The microphone is very clearly and sensitive. So phone calls are can be made at good quality. 
The operation is very easy. Just on or two short clicks or a long Click at the headphones. 
The installation was also very simple by using the JBL App.",5,jbl,Positive
97,Mrsheen,Not Happy,"Bought these to replace my Live Pro + I lost.
Only comes with 3 buds.
Customer service couldn't tell me the sizes before I purchased them.
I'm an xl JBL not sure if times are tough but you should have included the extra tips like in the + version.For the price you should have included it I had to buy aftermarket tips at an extra cost.
Also I'm.suprised you don't have a safe volume option and spacial sound.
Maybe there could be a firmware update.",3,jbl,Negative
98,taro,Good sound quality and battery life,"The sound quality has been the strength for me in the base response in different modes.  Good to stay connected with exception of in phone calls over 30 minutes, there are intermittent half a second pause in audio (but the person on the app the other end of the phone call stated they perceive no pause in the microphone transmission.) The ANC is effective but not as good in filter out medium frequency hums than the Bose headset that I have to compare it to.  The fit is adequate but for my ear cannel after 4 hours of wearing does give me some ear ache.  This could be just a price to pay for a good seal for the ANC.  To give the context I am using an iOS device with the Live Pro 2.",4,jbl,Positive
99,fayhope,New Favorite,Oh my gosh! These are my new favorite! These earphones are so comfortable and do not fall out. They sound they put out is absolutely amazing. I don't have to worry if it's raining outside because thankfully they are water resistant which is really good because I live in an area when you never know if you will get caught in a storm. They were easy to switch from on device to another and that is so helpful. The charge seems to last forever.,5,jbl,Positive
100,JD Ford,JBL got these right !,Wow JBL got these right!  The Live Pro 2 ear buds are truly amazing.  First the sound is incredibly full and has bass along with clarity.  They are excellent in noise cancelling the outside world.  I have used them mowing grass and I don't hear the mower just the music which is awesome.  I have wore these for several hours at a time and they are very comfortable in the ear and sweat does not seem to bother them.  They hold a charge well too for at least six hours at high volume.  These connected quickly to my phone and stayed connected so no issues with bluetooth.  I have owned many different ear buds and I have to say these are my favorite for sure.  I highly recommend them to anyone looking for excellent fullness with bass and clarity in their music.  These things do not disappoint so go ahead and buy you some they are a tremendous value for the sound quality.,5,jbl,Positive
101,boudreaux,Better than expected! Great color!,The JBL Live Pro 2 TWS were even better than I expected and I always expect JBL to be fabulous! The color is amazing and the sound is crystal clear. These earphones stay charged 10 hours and get to a 2 hour charge in just 15 minutes so if you need a quick charge for a run it is just perfect. I use them for calls and listening to music and they work great for both. They are so comfortable to wear and stay put. I love these!,5,jbl,Positive
102,Martyna1984,Great earbuds,"Overall JBL Live Pro 2 are great earphones. They were super easy and quick to connect to my iphone 12 - it took seconds. The sound quality is very good - I was very impressed actually. The noise cancelling is also pretty good. It definitely did irs job well on my recent flight full of noisy people! I could not hear a thing apart from my music. I like the charging case and the fact that it has lights that indicate the battery level. The fact that it closes with a magnet is also great; it feels that the earbuds are securely stored in the case. The product comes with 3 different size rubber caps that fit on the end of each earphone. Unfortunately I haven't been able to work out which size is best for me yet as the earbuds still fall out of my ears every now and again, especially during physical activity (gym). So this is something that I need to work on and figure out the best fit - hence my score of 4 stars",4,jbl,Positive
103,MikeD90,Blown away,So I have gone through many earbuds and Iâm very picky with fitment as I have small ears but theses are hands down the most comfortable Iâve had and the audio is insane using the equalizer on the app the bass hits hard and clear and crisp I highly recommend these to anyone who wants quality earbuds with amazing sound,5,jbl,Positive
104,JBlongz,Best ear buds I have  used.,Amazing sound for such a compact device.  The bass is clear and noise cancellation blocks external noise really well. I canât her my noisy air conditioner between songs. The case is sleek and magnetically grips your buds. The charging progress indicator lights on the case is a convenient feature. Highly recommended.,5,jbl,Positive
105,Diller,A big disappointment,"They didn't last a year. I loved them when they worked., but they have more issues than Time Magazine. I love JBL, but I will not buy any ear buds from them ever again. They don't carge correctly. They take 10 minutes to turn on. I troubleshoot and troubleshoot them almost every time I used them, I issues everysingletime i use them. Today i went to use them and 1 is 100%  and the other is 10% charged. I contacted JBL, sent in my information, they did nothing to cover their product. Soil will try different brand. This is ridiculous cause they are not used everyday, maybe twice a week.",2,jbl,Negative
106,Jeremy22,Outer space tank,"Iâve had these earbuds for about a year now and I think they deserve a review. I lost my left earbud for a month one time and had no idea where it went. Turns out I dropped it outside to my surprise I plug it back in and it works perfectly! With me mowing over it, rain and  cold temps it kept all its high tech features. This is as about 3 months ago and it still worksâ¦ Just an amazing product!",5,jbl,Positive
107,JBL stan,Absolutely abysmal piece of garbage,"I've been using these as a daily driver for 8 months now and they do have some good features (solid battery life and compact case), but also some horrible design flaws- such as the voice control that constantly turns on unprompted and will call random contacts without any noise in the room whatsoever... This leads to many awkward situations as one could imagine. The touch sensitivity of the earbuds is WAY too sensitive. I wish JBL would stick to refining just a few models of earbuds instead of releasing tons of mid tier ones.",1,jbl,Negative
108,Jaqueline87,Wow! Amazing sound and very nice look!,"I was very suprised by unboxing my package.
The In-Ears look very beautiful. The charging box has a very smooth touch, it lies well in the hand. The three lit bars indicate the battery status. So you can see very easiliy if you have to charge. 
The In-Ears fit perfectly in my ears. I'm not afraid to losing them.
And now to the sound: WOW! Clear and great sound. Noice cancelling is working very good. You can adjust the sound in the app until you find the perfect sound for you.
I've used samsung in-ears in the past. I have to say that these are significantly better. I love JBL.",5,jbl,Positive
109,Raichu,"Ok hardware, horrible firware/software updates","I've had these for almost a year and each software update makes the earbuds worse. 

They have great potential but the software is horrible.

The most recent firmware update makes multipoint audio completely useless.

Both devices will connect but audio will only play from the device that connected first.

You will have to manually turn Bluetooth on that device off to recieve audio from the 2nd device.

Headphones randomly pause themselves while audio is playing. 

None of the included ear tips fit correctly causing the earbuda to fall out of the ear constantly making anc useless.

Aftermarket ear tips would typically solves this but because of the oval shaped audio drivers most aftermarket eartips do not fit correctly.",2,jbl,Negative
110,sonofdavid,Excellent quality earbuds with 2 flaws,I just received these today and the audio is wonderful but I wish there was a 3d audio option like the lg fp8 has. Anc is good and transparency is good as well. The 2 flaws are that the app sometimes will not respond to my taps to enter the earbud option/adjustment screen so I'm stuck tapping on the screen until it finally opens up the options screen. Second flaw is a deal breaker for me (jbl correct me if I'm mistaken) and it is that I cannot turn the Anc on and off with earbud gestures  while on a phone call! I have to open up the app and do it there on my phone. I really love the look of these and their quality audio but unless these things change I will be sending them back and keeping the Lg fp8s.,3,jbl,Negative
111,Abdur 1982,Better than Apple or Bose headphones!,"Excellent quality headphones. Way better than Apple headphones and costs significantly less,",5,jbl,Positive
112,Lilposs72,"Great value, great sound and performanceð",So happy with my new JBLâs!! My new go-to earbudsð,5,jbl,Positive
113,nonameMK,JBL Live Pro 2 TWS,"I've been wanting to change out my wireless headphones for a while, and this particular model provides excellent music quality and all-day comfort. I was pleasantly surprised by the JBL Live Pro 2 TWS headphones, and I can say with certainty that they are among the best true wireless headphones on the market. The JBL Live Pro 2's audio output is simply exceptional. The headphones delivered a well-balanced and interesting sound when I listened to several musical genres. Active noise cancellation (ANC) is a feature that I especially appreciate. When ANC is turned on, background noise is efficiently eliminated, allowing me to focus solely on the music without interruptions. The several eartip options supplied with the JBL Live Pro 2 ensure an ideal fit. I wear the medium ones, and they are not uncomfortable to wear for extended periods of time. With ANC enabled, the headphones' playback time is roughly 9 hours; however, it can be increased to 30 hours by utilising the charging case. The JBL Live Pro 2 has a silky, modern aesthetic look. Bluetooth pairing is fast and stable, and I encountered no latency issues when listening to music or watching videos. The JBL Live Pro 2 TWS headphones are outstanding, to put it simply. All music lovers and those seeking true wireless headphones with high-quality audio should definitely consider these.",5,jbl,Positive
114,Agent Singh,Impressive Sound and ANC for the Price,"With crisp audio and a secure fit, the JBL Live Pro 2 earbuds deliver an impressive wireless listening experience. Their stylish and lightweight design makes them comfortable to wear for hours on end. The 11mm dynamic drivers produce bold, balanced sound with plenty of detail in the mids and highs. Bass lovers will appreciate the punchy low end, though it could be tighter and more accurate for critical listening. 

Active noise cancellation effectively blocks out ambient noise, with three modes to choose from depending on your surroundings. This makes the Live Pro 2 great for commuting or working in noisy environments. The six microphones pick up your voice clearly for phone calls too. 

Battery life is a highlight, lasting around 10 hours per charge with ANC on or 40 hours with the included charging case. The case provides multiple extra charges and has a nice compact shape. Quick charging gives you an hour of use from just 10 minutes in the case. 

Operation is smooth and intuitive with touch controls that are responsive yet resistant to accidental brushes. The JBL Headphones app unlocks customization options like EQ presets and Find My Buds. One minor downside is the large physical buttons, which press against your ear sometimes.

For around Â£125, the JBL Live Pro 2 deliver strong wireless sound and noise cancellation at a reasonable price point. Audiophiles may want more fidelity, but for everyday listening on the go, the Live Pro 2 get the job done very well. Their impressive battery life and lively sound make them easy to recommend.",5,jbl,Positive
115,knightlids,Great balance of performance and size,"Great sound, and perfect form factor. I've tried a few of JBL's soundbuds now and I think these are the perfect balance of features and performance. 

Enough bass, great clarify, the microphones seem to work well enough for calls, and the case isn't too bulky. I find that many earbud cases are just too big and the wrong shape to go in pockets. These are really good though for that, and stay closed. 

The noise cancelling works really well too, though like with all NC headphones and earbuds I've tried, it doesn't work when it's windy - the microphones end up picking up the wind noise and producing strange sounds to counteract it.",5,jbl,Positive
